{
  "$schema": "https://json-schema.org/draft/2020-12/schema",
  "$id": "https://traffictracer.local/contracts/pipeline-manifest.schema.json",
  "title": "TrafficTracer profile and proxy capture pipeline manifest",
  "type": "object",
  "additionalProperties": false,
  "required": ["schema_version", "pipeline_id", "state", "stage", "created_at", "updated_at", "output_root", "config", "targets", "execution", "policy", "current_run_index", "runs", "restore"],
  "properties": {
    "schema_version": { "enum": [1, 2, 3, 4, 5, 6, 7, 8, 9] },
    "pipeline_id": { "$ref": "#/$defs/uuid" },
    "state": { "enum": ["created", "validating", "running", "interrupted", "completed", "completed_with_degraded", "completed_with_errors", "failed", "cancelled", "restoring", "restore_failed"] },
    "stage": { "enum": ["queued", "materializing", "activating_profile", "waiting_controller", "selecting_proxy", "draining_connections", "preflight", "starting_batch", "running_batch", "reconciling_batch", "finalizing_batch", "verifying_protocol", "capture_wave", "analysis_wave", "checkpoint", "restoring", "finished"] },
    "created_at": { "type": "string", "format": "date-time" },
    "updated_at": { "type": "string", "format": "date-time" },
    "output_root": { "$ref": "#/$defs/absolutePath" },
    "config": { "type": "object", "additionalProperties": false, "required": ["path", "sha256"], "properties": { "path": { "$ref": "#/$defs/absolutePath" }, "sha256": { "type": "string", "pattern": "^[0-9a-f]{64}$" } } },
    "targets": { "type": "array", "minItems": 1, "maxItems": 1000, "uniqueItems": true, "items": { "$ref": "#/$defs/target" } },
    "policy": { "type": "object", "additionalProperties": false, "required": ["continue_on_run_failure", "restore_original_state"], "properties": { "continue_on_run_failure": { "type": "boolean" }, "restore_original_state": { "const": true } } },
    "execution": {
      "type": "object", "additionalProperties": false,
      "required": ["tun_interface", "physical_interface", "chrome_binary", "options", "fail_fast"],
      "properties": {
        "tun_interface": { "type": "string", "minLength": 1 },
        "physical_interface": { "type": "string", "minLength": 1 },
        "chrome_binary": { "$ref": "#/$defs/absolutePath" },
        "options": { "type": "object" },
        "fail_fast": { "type": "boolean" }
      }
    },
    "repetitions_per_candidate": { "type": "integer", "minimum": 1, "maximum": 20 },
    "schedule": { "$ref": "#/$defs/schedule" },
    "current_run_index": { "oneOf": [{ "type": "integer", "minimum": 0 }, { "type": "null" }] },
    "runs": { "type": "array", "minItems": 1, "maxItems": 20000, "items": { "$ref": "#/$defs/run" } },
    "restore": { "$ref": "#/$defs/restore" }
  },
  "allOf": [
    {
      "if": { "properties": { "schema_version": { "enum": [7, 8, 9] } }, "required": ["schema_version"] },
      "then": {
        "required": ["repetitions_per_candidate", "schedule"],
        "properties": {
          "runs": {
            "items": {
              "required": ["candidate_ordinal", "repetition_index", "repetition_total", "target_index", "session_ids", "application_retry_attempt", "prior_session_ids"]
            }
          }
        }
      }
    },
    {
      "if": { "properties": { "schema_version": { "const": 9 } }, "required": ["schema_version"] },
      "then": {
        "properties": {
          "runs": {
            "items": {
              "required": ["attempts", "selected_attempt"]
            }
          }
        }
      }
    }
  ],
  "$defs": {
    "uuid": { "type": "string", "pattern": "^[0-9a-fA-F]{8}-[0-9a-fA-F]{4}-[1-5][0-9a-fA-F]{3}-[89abAB][0-9a-fA-F]{3}-[0-9a-fA-F]{12}$" },
    "absolutePath": { "type": "string", "minLength": 1, "pattern": "^/" },
    "identifier": { "type": "string", "minLength": 1, "maxLength": 256, "not": { "pattern": "[\\r\\n\\u0000]" } },
    "target": {
      "type": "object", "additionalProperties": false,
      "required": ["index", "url", "domain", "duration_seconds", "network", "run_label", "wait_load_timeout", "page_type"],
      "properties": {
        "index": { "type": "integer", "minimum": 0 }, "url": { "type": "string", "pattern": "^https?://[^\\s]+$" },
        "domain": { "type": "string", "minLength": 1, "maxLength": 253 }, "duration_seconds": { "type": "integer", "minimum": 1, "maximum": 86400 },
        "network": { "enum": ["tcp", "udp", "all"] }, "run_label": { "type": "string", "pattern": "^[A-Za-z0-9][A-Za-z0-9._-]{0,63}$" },
        "wait_load_timeout": { "type": "integer", "minimum": 1, "maximum": 3600 }, "page_type": { "type": "string", "pattern": "^[a-z0-9][a-z0-9-]{0,63}$" },
        "playback": { "type": "object", "additionalProperties": false, "required": ["provider", "ad_policy", "desired_primary_seconds"], "properties": { "provider": { "const": "youtube" }, "ad_policy": { "const": "click_visible_skip" }, "desired_primary_seconds": { "type": "integer", "minimum": 1, "maximum": 86400 } } }
      }
    },
    "schedule": {
      "type": "object", "additionalProperties": false,
      "required": ["mode", "candidate_order_policy", "random_seed", "algorithm_version", "repetition_candidate_orders"],
      "properties": {
        "mode": { "enum": ["candidate_major", "repetition_target_candidate"] },
        "candidate_order_policy": { "enum": ["fixed", "balanced_seeded"] },
        "random_seed": { "oneOf": [{ "type": "integer", "minimum": 0 }, { "type": "null" }] },
        "algorithm_version": { "type": "integer", "const": 1 },
        "repetition_candidate_orders": {
          "type": "array",
          "items": { "type": "array", "minItems": 1, "uniqueItems": true, "items": { "type": "integer", "minimum": 1 } }
        }
      }
    },

    "error": { "oneOf": [{ "type": "null" }, { "type": "object", "additionalProperties": false, "required": ["code", "message"], "properties": { "code": { "type": "string", "minLength": 1 }, "message": { "type": "string", "minLength": 1 } } }] },
    "qualityPlane": {
      "type": "object", "additionalProperties": false,
      "required": ["state", "passed", "degraded", "failed", "indeterminate", "not_applicable"],
      "properties": {
        "state": { "enum": ["passed", "degraded", "failed", "indeterminate", "not_applicable"] },
        "passed": { "type": "integer", "minimum": 0 }, "degraded": { "type": "integer", "minimum": 0 },
        "failed": { "type": "integer", "minimum": 0 }, "indeterminate": { "type": "integer", "minimum": 0 },
        "not_applicable": { "type": "integer", "minimum": 0 }
      }
    },
    "applicationIssue": {
      "type": "object", "additionalProperties": false,
      "required": ["session_id", "target_url", "final_url", "state", "reason", "primary_content_millis", "desired_primary_seconds"],
      "properties": {
        "session_id": { "type": "string" }, "target_url": { "type": "string" },
        "final_url": { "oneOf": [{ "type": "string" }, { "type": "null" }] },
        "state": { "enum": ["degraded", "failed", "indeterminate"] },
        "reason": { "oneOf": [{ "type": "string" }, { "type": "null" }] },
        "origin": { "oneOf": [{ "type": "string" }, { "type": "null" }] },
        "retryable": { "oneOf": [{ "type": "boolean" }, { "type": "null" }] },
        "primary_content_millis": { "oneOf": [{ "type": "integer", "minimum": 0 }, { "type": "null" }] },
        "desired_primary_seconds": { "oneOf": [{ "type": "integer", "minimum": 0 }, { "type": "null" }] }
      }
    },
    "runQuality": {
      "type": "object", "additionalProperties": false,
      "required": ["sessions_total", "capture_integrity", "correlation", "application", "application_issues"],
      "properties": {
        "sessions_total": { "type": "integer", "minimum": 0 },
        "analysis_generations": {
          "type": "array",
          "items": {
            "type": "object", "additionalProperties": false,
            "required": ["session_id", "generation_id"],
            "properties": {
              "session_id": { "$ref": "#/$defs/uuid" },
              "generation_id": { "$ref": "#/$defs/uuid" }
            }
          }
        },
        "local_runtime": { "$ref": "#/$defs/qualityPlane" },
        "capture_integrity": { "$ref": "#/$defs/qualityPlane" },
        "correlation": { "$ref": "#/$defs/qualityPlane" },
        "application": { "$ref": "#/$defs/qualityPlane" },
        "application_issues": { "type": "array", "items": { "$ref": "#/$defs/applicationIssue" } }
      }
    },
    "proxySnapshot": {
      "type": "object", "additionalProperties": false,
      "required": ["profile_uid", "profile_fingerprint", "selection_group", "selected_node", "resolved_chain", "resolved_leaf", "protocol", "captured_at"],
      "properties": {
        "profile_uid": { "$ref": "#/$defs/identifier" }, "profile_fingerprint": { "type": "string", "pattern": "^[0-9a-f]{64}$" },
        "selection_group": { "$ref": "#/$defs/identifier" }, "selected_node": { "$ref": "#/$defs/identifier" },
        "resolved_chain": { "type": "array", "minItems": 1, "items": { "$ref": "#/$defs/identifier" } },
        "resolved_leaf": { "$ref": "#/$defs/identifier" }, "protocol": { "type": "string", "pattern": "^[a-z0-9]*$" },
        "captured_at": { "type": "string", "format": "date-time" }
      }
    },
    "connectionDrain": {
      "type": "object", "additionalProperties": false,
      "required": ["state", "initial_connections", "final_connections", "polls", "quiet_millis", "error", "completed_at"],
      "properties": {
        "state": { "enum": ["preserved", "drained", "timeout", "controller_unavailable", "close_failed"] },
        "initial_connections": { "oneOf": [{ "type": "integer", "minimum": 0 }, { "type": "null" }] },
        "final_connections": { "oneOf": [{ "type": "integer", "minimum": 0 }, { "type": "null" }] },
        "polls": { "type": "integer", "minimum": 0 }, "quiet_millis": { "type": "integer", "minimum": 0 },
        "error": { "oneOf": [{ "type": "string" }, { "type": "null" }] }, "completed_at": { "type": "string", "format": "date-time" }
      }
    },
    "runVerification": {
      "type": "object", "additionalProperties": false,
      "required": ["node_state", "protocol_state", "observed_protocols", "observed_selected_nodes", "observed_leaf_nodes", "details", "checked_at"],
      "properties": {
        "node_state": { "enum": ["passed", "node_drift", "observation_unavailable"] },
        "protocol_state": { "enum": ["passed", "protocol_mismatch", "observation_unavailable"] },
        "observed_protocols": { "type": "array", "uniqueItems": true, "items": { "type": "string", "pattern": "^[a-z0-9]*$" } },
        "observed_selected_nodes": { "type": "array", "uniqueItems": true, "items": { "$ref": "#/$defs/identifier" } },
        "observed_leaf_nodes": { "type": "array", "uniqueItems": true, "items": { "$ref": "#/$defs/identifier" } },
        "details": { "type": "array", "items": { "type": "string" } }, "checked_at": { "type": "string", "format": "date-time" }
      }
    },
    "profileActivation": {
      "type": "object", "additionalProperties": false,
      "required": ["source_profile_uid", "target_profile_uid", "requested_at", "profile_already_active", "resumed_from_committed_state", "profile_committed_at", "controller_verified_at", "last_completed_step"],
      "properties": {
        "source_profile_uid": { "oneOf": [{ "$ref": "#/$defs/identifier" }, { "type": "null" }] },
        "target_profile_uid": { "$ref": "#/$defs/identifier" },
        "requested_at": { "type": "string", "format": "date-time" },
        "profile_already_active": { "type": "boolean" },
        "resumed_from_committed_state": { "type": "boolean" },
        "profile_committed_at": { "oneOf": [{ "type": "string", "format": "date-time" }, { "type": "null" }] },
        "controller_verified_at": { "oneOf": [{ "type": "string", "format": "date-time" }, { "type": "null" }] },
        "last_completed_step": { "enum": ["activation_requested", "profile_committed", "controller_verified"] }
      }
    },
    "runEvidence": {
      "type": "object", "additionalProperties": false,
      "properties": {
        "profile_activation": { "$ref": "#/$defs/profileActivation" },
        "selection_snapshot": { "$ref": "#/$defs/proxySnapshot" }, "drain": { "$ref": "#/$defs/connectionDrain" },
        "pre_batch_snapshot": { "$ref": "#/$defs/proxySnapshot" }, "end_snapshot": { "$ref": "#/$defs/proxySnapshot" },
        "verification": { "$ref": "#/$defs/runVerification" }
      }
    },
    "runAttempt": {
      "type": "object", "additionalProperties": false,
      "required": ["ordinal", "state", "observed_protocol", "session_ids", "batch_id", "error", "selected", "started_at", "completed_at"],
      "properties": {
        "ordinal": { "type": "integer", "minimum": 1, "maximum": 2 },
        "state": { "enum": ["completed", "degraded", "failed", "interrupted", "skipped", "cancelled"] },
        "observed_protocol": { "type": "string", "pattern": "^[A-Za-z0-9_-]*$" },
        "session_ids": { "type": "array", "uniqueItems": true, "items": { "$ref": "#/$defs/uuid" } },
        "batch_id": { "oneOf": [{ "$ref": "#/$defs/uuid" }, { "type": "null" }] },
        "analysis_job_id": { "$ref": "#/$defs/uuid" },
        "quality": { "$ref": "#/$defs/runQuality" },
        "evidence": { "$ref": "#/$defs/runEvidence" },
        "error": { "$ref": "#/$defs/error" },
        "selected": { "type": "boolean" },
        "selection_reason": { "type": "string", "enum": ["only_attempt", "latest_attempt_improved_quality", "prior_attempt_retained_quality_tie", "prior_attempt_retained_retry_regressed", "legacy_manifest_projection"] },
        "started_at": { "oneOf": [{ "type": "string", "format": "date-time" }, { "type": "null" }] },
        "completed_at": { "oneOf": [{ "type": "string", "format": "date-time" }, { "type": "null" }] }
      }
    },
    "restoreCheck": {
      "type": "object", "additionalProperties": false,
      "required": ["component", "target", "requested", "observed", "state", "code", "message", "checked_at"],
      "properties": {
        "component": { "enum": ["profile", "selector"] }, "target": { "$ref": "#/$defs/identifier" }, "requested": { "$ref": "#/$defs/identifier" },
        "observed": { "oneOf": [{ "$ref": "#/$defs/identifier" }, { "type": "null" }] },
        "state": { "enum": ["passed", "request_failed", "controller_unavailable", "readback_mismatch"] },
        "code": { "oneOf": [{ "type": "string" }, { "type": "null" }] }, "message": { "oneOf": [{ "type": "string" }, { "type": "null" }] },
        "checked_at": { "type": "string", "format": "date-time" }
      }
    },
    "run": {
      "type": "object", "additionalProperties": false,
      "required": ["ordinal", "run_id", "profile_uid", "profile_fingerprint", "selection_group", "requested_node", "state", "stage", "resolved_chain", "resolved_leaf", "expected_protocol", "observed_protocol", "batch_id", "output_path", "error", "resume_attempt", "started_at", "completed_at"],
      "properties": {
        "ordinal": { "type": "integer", "minimum": 1 }, "candidate_ordinal": { "type": "integer", "minimum": 1 },
        "repetition_index": { "type": "integer", "minimum": 1 }, "repetition_total": { "type": "integer", "minimum": 1, "maximum": 20 },
        "target_index": { "type": "integer", "minimum": 0 },
        "run_id": { "$ref": "#/$defs/uuid" }, "profile_uid": { "$ref": "#/$defs/identifier" },
        "profile_fingerprint": { "type": "string", "pattern": "^[0-9a-f]{64}$" }, "profile_fingerprint_kind": { "enum": ["runtime_bytes_v1", "runtime_semantic_v2"] }, "queued_profile_fingerprint": { "type": "string", "pattern": "^[0-9a-f]{64}$" }, "profile_bound_at": { "type": "string", "format": "date-time" }, "profile_snapshot_changed": { "type": "boolean" }, "selection_group": { "$ref": "#/$defs/identifier" }, "requested_node": { "$ref": "#/$defs/identifier" },
        "state": { "enum": ["pending", "running", "captured", "analyzing", "retry_pending", "completed", "degraded", "failed", "interrupted", "skipped", "cancelled"] },
        "stage": { "enum": ["queued", "activating_profile", "waiting_controller", "selecting_proxy", "draining_connections", "preflight", "starting_batch", "running_batch", "reconciling_batch", "finalizing_batch", "verifying_protocol", "capture_wave", "analysis_wave", "checkpoint", "finished"] },
        "resolved_chain": { "type": "array", "items": { "$ref": "#/$defs/identifier" } }, "resolved_leaf": { "oneOf": [{ "$ref": "#/$defs/identifier" }, { "type": "null" }] },
        "expected_protocol": { "type": "string", "pattern": "^[A-Za-z0-9_-]*$" }, "observed_protocol": { "type": "string", "pattern": "^[A-Za-z0-9_-]*$" },
        "batch_id": { "oneOf": [{ "$ref": "#/$defs/uuid" }, { "type": "null" }] }, "output_path": { "$ref": "#/$defs/absolutePath" }, "error": { "$ref": "#/$defs/error" },
        "session_ids": { "type": "array", "uniqueItems": true, "items": { "$ref": "#/$defs/uuid" } },
        "analysis_job_id": { "$ref": "#/$defs/uuid" },
        "application_retry_attempt": { "type": "integer", "minimum": 0, "maximum": 1 },
        "prior_session_ids": { "type": "array", "uniqueItems": true, "items": { "$ref": "#/$defs/uuid" } },
        "attempts": { "type": "array", "maxItems": 2, "items": { "$ref": "#/$defs/runAttempt" } },
        "selected_attempt": { "oneOf": [{ "type": "integer", "minimum": 1, "maximum": 2 }, { "type": "null" }] },
        "quality": { "$ref": "#/$defs/runQuality" },
        "evidence": { "$ref": "#/$defs/runEvidence" },
        "resume_attempt": { "type": "integer", "minimum": 0 }, "started_at": { "oneOf": [{ "type": "string", "format": "date-time" }, { "type": "null" }] }, "completed_at": { "oneOf": [{ "type": "string", "format": "date-time" }, { "type": "null" }] }
      }
    },
    "restore": {
      "type": "object", "additionalProperties": false, "required": ["profile_uid", "selections", "state", "error"],
      "properties": {
        "profile_uid": { "oneOf": [{ "$ref": "#/$defs/identifier" }, { "type": "null" }] },
        "profile_fingerprint": { "type": "string", "pattern": "^[0-9a-f]{64}$" },
        "terminal_state": { "enum": ["created", "validating", "running", "interrupted", "completed", "completed_with_degraded", "completed_with_errors", "failed", "cancelled"] },
        "selections": { "type": "array", "items": { "type": "object", "additionalProperties": false, "required": ["group", "node"], "properties": { "group": { "$ref": "#/$defs/identifier" }, "node": { "$ref": "#/$defs/identifier" } } } },
        "checks": { "type": "array", "items": { "$ref": "#/$defs/restoreCheck" } },
        "state": { "enum": ["pending", "not_required", "restoring", "restored", "failed"] }, "error": { "$ref": "#/$defs/error" }
      }
    }
  }
}
