{
  "schema_version": 2,
  "pipeline_id": "6ea29d49-4f0e-4f9b-8a88-0ad095c50b78",
  "state": "completed_with_errors",
  "stage": "finished",
  "created_at": "2026-09-01T01:00:00Z",
  "updated_at": "2026-09-01T02:00:00Z",
  "output_root": "/tmp/traffictracer/pipeline",
  "config": { "path": "/tmp/sites.yaml", "sha256": "aaaaaaaaaaaaaaaaaaaaaaaaaaaaaaaaaaaaaaaaaaaaaaaaaaaaaaaaaaaaaaaa" },
  "targets": [{ "index": 0, "url": "https://www.youtube.com/watch?v=example", "domain": "youtube.com", "duration_seconds": 35, "network": "all", "run_label": "youtube-video", "wait_load_timeout": 30, "page_type": "youtube-video-play" }],
  "execution": {
    "tun_interface": "Meta",
    "physical_interface": "eth0",
    "chrome_binary": "/usr/bin/google-chrome",
    "options": { "capture_packets": true },
    "fail_fast": false
  },
  "policy": { "continue_on_run_failure": true, "restore_original_state": true },
  "current_run_index": null,
  "runs": [{
    "ordinal": 1, "run_id": "e107516f-335d-42f5-b9f4-f71c081c41e7", "profile_uid": "profile-local-1",
    "profile_fingerprint": "bbbbbbbbbbbbbbbbbbbbbbbbbbbbbbbbbbbbbbbbbbbbbbbbbbbbbbbbbbbbbbbb", "selection_group": "GLOBAL", "requested_node": "test-node",
    "state": "degraded", "stage": "finished", "resolved_chain": ["test-node"], "resolved_leaf": "test-node", "expected_protocol": "shadowsocks", "observed_protocol": "shadowsocks",
    "batch_id": "e38c26b7-789c-4aa0-b1bb-e3d5916390af", "output_path": "/tmp/traffictracer/pipeline/runs/001_0123456789ab", "error": null,
    "quality": {
      "sessions_total": 1,
      "capture_integrity": { "state": "passed", "passed": 1, "degraded": 0, "failed": 0, "indeterminate": 0, "not_applicable": 0 },
      "correlation": { "state": "passed", "passed": 1, "degraded": 0, "failed": 0, "indeterminate": 0, "not_applicable": 0 },
      "application": { "state": "failed", "passed": 0, "degraded": 0, "failed": 1, "indeterminate": 0, "not_applicable": 0 },
      "application_issues": [{
        "session_id": "20260901T010100.000000Z_11111111-1111-4111-8111-111111111111",
        "target_url": "https://www.youtube.com/watch?v=example",
        "final_url": "https://www.google.com/sorry/",
        "state": "failed", "reason": "PLAYER_NOT_CREATED",
        "primary_content_millis": 0, "desired_primary_seconds": 25
      }]
    },
    "resume_attempt": 0, "started_at": "2026-09-01T01:01:00Z", "completed_at": "2026-09-01T01:59:00Z"
  }],
  "restore": { "profile_uid": "profile-local-1", "selections": [{ "group": "GLOBAL", "node": "original-node" }], "state": "restored", "error": null }
}
